Lyrics (Hook),Song Title
"Don't say yes, run away now
I'll meet you when you're out
Of the church, at the back door
Don't wait or say a single vow
You need to hear me out
And they said, ""Speak now""

Don't say yes, run away now
I'll meet you when you're out
Of the church, at the back door
Don't wait or say a single vow
You need to hear me out
And they said, ""Speak now""
Don't say yes, run away now (Run away now)
I'll meet you when you're out
Of the church, at the back door
Don't wait or say a single vow (Say a single vow)
Your time is running out
And they said, ""Speak now""

So, don't say yes, run away now
I'll meet you when you're out
Of the church, at the back door
Don't wait or say a single vow
You need to hear me out
They said, ""Speak now""
And you say, ""Let's run away now (Run away now)
I'll meet you when I'm out
Of my tux, at the back door
Baby, I didn't say my vows (Say a single vow)
So glad you were around
When they said, 'Speak now'""",Speak Now
"And I never (Never)
Saw you comin'
And I'll never (Never)
Be the same",State of Grace (Taylor's Version)
"Now, I'm standing alone in a crowded room
And we're not speaking
And I'm dying to know
Is it killing you like it's killing me? Yeah
I don't know what to say since the twist of fate
When it all broke down
And the story of us looks a lot like a tragedy now

Now, I'm standing alone in a crowded room
And we're not speaking
And I'm dying to know
Is it killing you like it's killing me? Yeah
I don't know what to say since the twist of fate
When it all broke down
The story of us looks a lot like a tragedy now, now, now
And we're not speaking
And I'm dying to know
Is it killing you like it's killing me? Yeah
I don't know what to say since the twist of fate
'Cause we're goin' down
And the story of us looks a lot like a tragedy now",The Story of Us
"You got that James Dean daydream look in your eye / And I got that red lip classic thing that you like / And when we go crashing down, we come back every time / We never go out of style, we never go out of style",Style
"There you stand, ten feet tall
I will say, ""I knew it all along""
Your eyes are wider than distance
This life is sweeter than fiction

There you stand, ten feet tall
I will say, ""I knew it all along""
Your eyes are wider than distance
This life is sweeter than fiction
There you stand, next to me
All at once, the rest is history
Your eyes are wider than distance
This life is sweeter than fiction, fiction",Sweeter Than Fiction
"He's the reason for the teardrops on my guitar
The only thing that keeps me wishin' on a wishing star
He's the song in the car I keep singing, don't know why I do

'Cause he's the reason for the teardrops on my guitar
The only one who's got enough of me to break my heart
He's the song in the car I keep singing, don't know why I do",Teardrops on My Guitar
"But when you think Tim McGraw
I hope you think my favorite song
The one we danced to all night long
The moon like a spotlight on the lake
When you think happiness
I hope you think that little black dress
Think of my head on your chest
And my old faded blue jeans
When you think Tim McGraw
I hope you think of me

Is, ""When you think Tim McGraw
I hope you think my favorite song
Someday you'll turn your radio on
I hope it takes you back to that place""
When you think happiness
I hope you think that little black dress
Think of my head on your chest
And my old faded blue jeans
When you think Tim McGraw
I hope you think of me",Tim McGraw
"Well, can you feel this magic in the air?
It must have been the way you kissed me
Fell in love when I saw you standing there
It must have been the way
Today was a fairytale
It must have been the way
Today was a fairytale",Today Was a Fairytale (Taylor's Version)
"So maybe it's true that I can't live without you
And maybe two is better than one
But there's so much time to figure out the rest of my life
And you've already got me coming undone
And I'm thinking two is better than one",Two Is Better Than One (feat. Taylor Swift)
"We are never, evеr, ever getting back togеther
We are never, ever, ever getting back together
You go talk to your friends, talk to my friends, talk to me
But we are never, ever, ever, ever getting back together",We Are Never Ever Getting Back Together (Taylor's Version)
"That I'm not a princess, this ain't a fairytale
I'm not the one you'll sweep off her feet, lead her up the stairwell
This ain't Hollywood, this is a small town
I was a dreamer before you went and let me down
Now it's too late for you and your white horse
To come around

'Cause I'm not your princess, this ain't our fairytale
I'm gonna find someone someday
Who might actually treat me well
This is a big world, that was a small town
There in my rearview mirror disappearing now
And it's too late for you and your white horse
Now it's too late for you and your white horse
To catch me now",White Horse (Taylor's Version)
"Say you'll remember me
Standin' in a nice dress
Starin' at the sunset, babe
Red lips and rosy cheeks
Say you'll see me again
Even if it's just in your
Wildest dreams, ah, ha
Wildest dreams, ah, ha",Wildest Dreams (Taylor's Version)
"The more that you say, the less I know
Wherever you stray, I follow
I'm begging for you to take my hand
Wreck my plans, that's my man",Willow
"I lived and I learned
Had you, got burned
Held out and held on
God knows, too long, and wasted time
Lost tears, swore that I'd get out of here
But no amount of freedom gets you clean
I've still got you all over me

I lived and I learned
And found out what it was to turn around
And see that we
Were never really meant to be
So I lied, and I cried
And I watched a part of myself die
'Cause no amount of freedom gets you clean
I've still got you all over me",You All Over Me (Taylor's Version) (From the Vault)
"If you could see that I'm the onе who understands you
Been here all along, so why can't you see?
You bеlong with me, you belong with me

If you could see that I'm the one who understands you
Been here all along, so why can't you see?
You belong with me
Standing by and waiting at your back door
All this time how could you not know, baby?
You belong with me, you belong with me",You Belong with Me (Taylor's Version)
"So oh-oh, oh-oh, oh-oh, oh-oh, oh-oh
You need to calm down, you're being too loud
And I'm just like oh-oh, oh-oh, oh-oh, oh-oh, oh-oh (Oh)
You need to just stop, like can you just not step on my gown?
You need to calm down

Oh-oh, oh-oh, oh-oh, oh-oh, oh-oh
You need to calm down (You need to calm down)
You're being too loud (You're being too loud)
And I'm just like oh-oh, oh-oh, oh-oh, oh-oh, oh-oh (Oh)
You need to just stop (Can you stop?)
Like can you just not step on our gowns?
You need to calm down",You Need to Calm Down
"You don't have to call anymore
I won't pick up the phone
This is the last straw
Don't wanna hurt anymore
And you can tell me that you're sorry
But I don't believe you, baby, like I did before
You're not sorry
No, no, oh-oh",You're Not Sorry (Taylor's Version)