Lyrics (Hook),Song Title
"In the middle of the night, in my dreams
You should see the things we do, baby
In the middle of the night, in my dreams
I know I'm gonna be with you, so I take my time
Are you ready for it?",...Ready for It?
"Causе there we arе again on that little town street
You almost ran the red 'cause you were lookin' over at me
Wind in my hair, I was there
I remember it all too well

'Cause there we are again in the middle of the night
We're dancin' 'round the kitchen in the refrigerator light
Down the stairs, I was there
I remember it all too well
And there we are again when nobody had to know
You kept me like a secret, but I kept you like an oath
Sacred prayer and we'd swear
To remember it all too well, yeah

'Cause there we are again when I loved you so
Back before you lost the one real thing you've ever known
It was rare, I was there
I remember it all too well
Wind in my hair, you were there
You remember it all
Down the stairs, you were there
You remember it all
It was rare, I was there
I remember it all too well",All Too Well (10 Minute Version) (Taylor's Version) (From the Vault)
"It's me, hi
I'm the problem, it's me
At teatime, everybody agrees
I'll stare directly at the sun, but never in the mirror
It must be exhausting always rooting for the anti-hero",Anti-Hero
"You really blew this, babe
We ain't getting through this one, babe
This is the last time I'll ever call you, babe (This is the last time, this is the last time)
This is the last time I'll ever call you, babe
(What about your promises, promises, promises?)

You really blew this, babe
We ain't getting through this one, babe
This is the last time I'll ever call you, babe (This is the last time, this is the last time)
This is the last time I'll ever call you",Babe (Taylor's Version) (From the Vault)
"So, this is me swallowing my pride
Standing in front of you saying, ""I'm sorry for that night""
And I go back to December all the time
It turns out freedom ain't nothing but missing you
Wishing I'd realized what I had when you were mine
I go back to December, turn around and make it alright
I go back to December all the time

So, this is me swallowing my pride
Standing in front of you, saying, ""I'm sorry for that night""
And I go back to December all the time
It turns out freedom ain't nothing but missing you
Wishing I'd realized what I had when you were mine
I go back to December, turn around and change my own mind
I go back to December all the time

But this is me swallowing my pride
Standing in front of you, saying, ""I'm sorry for that night""
And I go back to December
It turns out freedom ain't nothing but missing you
Wishing I'd realized what I had when you were mine
I go back to December, turn around and make it alright
I go back to December, turn around and change my own mind
I go back to December all the time",Back to December
"Cause baby, now we've got bad blood
You know it used to be mad love
So take a look what you've done
'Cause baby, now we've got bad blood, hey!
Now we've got problems
And I don't think we can solve 'em
You made a really deep cut
And baby, now we've got bad blood, hey!

'Cause baby, now we've got bad blood
You know it used to be mad love
So take a look what you've done
'Cause baby, now we've got bad blood, hey!
Now we've got problems
And I don't think we can solve 'em (Think we can solve 'em)
You made a really deep cut
And baby, now we've got bad blood, hey!
'Cause baby, now we've got bad blood
You know it used to be mad love
So take a look what you've done (Look what you've done)
'Cause baby, now we've got bad blood, hey!
Now we've got problems
And I don't think we can solve 'em
You made a really deep cut
And baby, now we've got bad blood, hey!",Bad Blood
"All that I wanted was to be wanted
Too young to wander London streets, alone and haunted
Born into nothing
At least you have something, something to cling to
Visions of dazzling rooms I'll never get let into
And the memories were lost long ago
But at least you have beautiful ghosts

All that I wanted was to be wanted
I'll never wander London streets, alone and haunted
Born into nothing
With them, I have something, something to cling to
I never knew I'd love this world they've let me into
And the memories were lost long ago
So I'll dance with these beautiful ghosts
And the memories were lost long ago
So I'll dance with these beautiful ghosts",Beautiful Ghosts
"And you throw your head back laughing like a little kid
I think it's strange that you think I'm funny 'cause he never did
I've been spending the last eight months
Thinking all love ever does is break, and burn, and end
But on a Wеdnesday in a café, I watched it begin again",Begin Again (Taylor's Version)
"Sometimes, in the middle of the night, I can feel you again
But I just miss you, and I just wish you were a better man
And I know why we had to say goodbye like the back of my hand
But I just miss you, and I just wish you were a better man
A better man

Sometimes, in the middle of the night, I can feel you again
But I just miss you, and I just wish you were a better man
And I know why we had to say goodbye, like the back of my hand
But I just miss you, and I just wish you were a better man
A better man
(Sometimes, in the middle of the night, I can feel you again)
We might still be in love, if you were a better man
(But I just miss you and I just wish you were a better man)
Yeah, yeah
I know why we had to say goodbye like the back of my hand
But I just miss you and I just wish you were a better man
A better man",Better Man (Taylor's Version) (From the Vault)
"But if I just showed up at your party
Would you have me? Would you want me?
Would you tell me to go fuck myself
Or lead me to the garden?
In the garden, would you trust me
If I told you it was just a summer thing?
I'm only seventeen, I don't know anything
But I know I miss you

Yeah, I showed up at your party
Will you have me? Will you love me?
Will you kiss me on the porch
In front of all your stupid friends?
If you kiss me, will it be just like I dreamed it?
Will it patch your broken wings?
I'm only seventeen, I don't know anything
But I know I miss you",Betty
"So, it's gonna be forever
Or it's gonna go down in flames?
You can tell me when it's over, mm
If the high was worth the pain
Got a long list of ex-lovers
They'll tell you I'm insane
'Cause you know I love the players
And you love the game
'Cause we're young and we're reckless
We'll take this way too far
It'll leave you breathless, mm
Or with a nasty scar
Got a long list of ex-lovers
They'll tell you I'm insane
But I've got a blank space, baby
And I'll write your name",Blank Space
"I wish I was strong enough to lift not one but both of us
Some day I will be strong enough to lift not one but both of us",Both of Us (feat. Taylor Swift)
"But I knew you
Dancin' in your Levi's
Drunk under a streetlight, I
I knew you
Hand under my sweatshirt
Baby, kiss it better, I
[Refrain]
And when I felt like I was an old cardigan
Under someone's bed
You put me on and said I was your favorite

But I knew you
Playing hide-and-seek and
Giving me your weekends, I
I knew you
Your heartbeat on the High Line
Once in twenty lifetimes, I

'Cause I knew you
Steppin' on the last train
Marked me like a bloodstain, I
I knew you
Tried to change the ending
Peter losing Wendy, I
I knew you
Leavin' like a father
Running like water, I
And when you are young, they assume you know nothing",Cardigan
"Into the mist, into the clouds
Don't leave
I make a fist, I'll make it count
And there are places I will never, ever go
And things that only Carolina will ever know",Carolina
"Because these things will change
Can you feel it now?
These walls that they put up to hold us back will fall down
This revolution, the time will come
For us to finally win
And we’ll sing hallelujah, we'll sing hallelujah
Oh, oh

It was the night things changed
Can you see it now?
When the walls that they put up to hold us back fell down
It's a revolution, throw your hands up
'Cause we never gave in
And we'll sing hallelujah, we sang hallelujah
Hallelujah",Change (Taylor's Version)
"Under the mistletoe
Watchin' the fire glow
And tellin' me, ""I love you""
Just bein' in your arms
Takes me back to that little farm
Where every wish comes true

Under the mistletoe (To you)
Watching the fire glow
And tellin' me, ""I love you""",Christmas Tree Farm
"You lift my feet off the ground
You spin me around
You make me crazier, crazier
Feels like I'm fallin' and I am lost in your eyes
You make me crazier, crazier, crazier",Crazier
"Is it cool that I said all that?
Is it chill that you're in my head?
'Cause I know that it's delicate (Delicate)
Is it cool that I said all that?
Is it too soon to do this yet?
'Cause I know that it's delicate

('Cause I like you)
Is it cool that I said all that?
Is it chill that you're in my head?
'Cause I know that it's delicate (Delicate)
(Yeah, I want you)
Is it cool that I said all that?
Is it too soon to do this yet?
'Cause I know that it's delicate (Delicate)
('Cause I like you)
Is it cool that I said all that? (Isn't it?)
Is it chill that you're in my head? (Isn't it? Isn't it?)
'Cause I know that it's delicate (Isn't it delicate?)
(Yeah, I want you)
Is it cool that I said all that? (Isn't it?)
Is it too soon to do this yet? (Isn't it? Isn't it?)
'Cause I know that it's delicate
Isn't it delicate?",Delicate
"I wanna be your end game
I wanna be your first string
I wanna be your A-Team (Woah, woah, woah)
I wanna be your end game, end game

I wanna be your end game (End game)
I wanna be your first string (First string)
I wanna be your A-Team (A-Team)
I wanna be your end game, end game

I wanna be your end game (End game)
I wanna be your first string (Me and you; First string)
I wanna be your A-Team (Be your A-Team now; A-Team)
I wanna be your end game, end game
I wanna be your end game (Oh, I do)
I wanna be your first string (First string)
I wanna be your A-Team (A-Team)
I wanna be your end game, end game",End Game
"Cause all I know is we said hello
And your eyes look like coming homе
All I know is a simple name
Everything has changеd
All I know is you held the door
You'll be mine and I'll be yours
All I know since yesterday
Is everything has changed",Everything Has Changed (Taylor's Version)
"I think I've seen this film before
And I didn't like the ending
You're not my homeland anymore
So what am I defending now?
You were my town, now I'm in exile, seein' you out
I think I've seen this film before

I think I've seen this film before
And I didn't like the ending
I'm not your problem anymore
So who am I offending now?
You were my crown, now I'm in exile, seein' you out
I think I've seen this film before
So I'm leaving out the side door",Exile
"Everybody's waitin' for you to break down
Everybody's watchin' to see the fallout
Even when you're sleepin', sleepin'
Keep your eyes open",Eyes Open (Taylor's Version)
"And I don't know how it gets better than this
You take my hand and drag me head first, fearless
And I don't know why but with you I'd dance
In a storm in my best dress, fеarless",Fearless (Taylor's Version)
"Cause when you're fifteen and somebody tells you they love you
You're gonna believe them
And when you're fifteen, feelin' like there's nothin' to figure out
Well, count to ten, take it in
This is life before you know who you're gonna be
At fifteen

'Cause when you're fifteen and somebody tells you they love you
You're gonna believe them
And when you're fifteen and your first kiss
Makes your head spin around, well
In your life you'll do things greater than
Datin' the boy on the football team
I didn't know it at fifteen

'Cause when you're fifteen and somebody tells you they love you
You're gonna believe them
And when you're fifteen, don't forget to look before you fall
But I've found time can heal most anything
And you just might find who you're supposed to be
I didn't know who I was supposed to be
At fifteen",Fifteen (Taylor's Version)
"I don't wanna live forever
'Cause I know I'll be living in vain
And I don't wanna fit wherever
I just wanna keep calling your name
Until you come back home
I just wanna keep calling your name
Until you come back home
I just wanna keep calling your name
Until you come back home",I Don't Wanna Live Forever (ZAYN & Taylor Swift)
"Cause I knew you were troublе when you walked in
So shame on mе now
Flew me to places I'd never been
'Til you put me down, oh
I knew you were trouble when you walked in
So shame on me now
Flew me to places I'd never been
Now I'm lying on the cold hard ground
Oh, oh
Trouble, trouble, trouble
Oh, oh
Trouble, trouble, trouble",I Knew You Were Trouble (Taylor's Version)
"Come back, come back, come back to me like
You would, you would if this was a movie
Stand in the rain outside 'til I came out
Come back, come back, come back to me like
You could, you could if you just said you're sorry
I know that we could work it out somehow
But if this was a movie, you'd be here by now",If This Was a Movie (Taylor's Version)
"Cause karma is my boyfriend
Karma is a god
Karma is the breeze in my hair on the weekend
Karma's a relaxing thought
Aren't you envious that for you it's not?
Sweet like honey, karma is a cat
Purring in my lap 'cause it loves me
Flexing like a goddamn acrobat
Me and karma vibe like tha
",Karma
"This is the last time I'm asking you this
Put my name at the top of your list
This is the last time I'm asking you why
You break my heart in the blink of an eye, eye, eye

This is the last time I'm asking you this
Put my name at the top of your list
This is the last time I'm asking you why
You break my heart in the blink of an eye
This is the last time I'm asking you this (This is the last time I'm asking you this)
Put my name at the top of your list (Put my name at the top of your list)
This is the last time I'm asking you why (This is the last time I'm asking you why)
You break my heart in the blink of an eye (You break my heart)",The Last Time (Taylor's Version)
"I feel
The lavender haze creeping up on me
Surreal
I'm damned if I do give a damn what people say
No deal
The 1950s shit they want from me
I just wanna stay in that lavender haze",Lavender Haze
"Ooh, look what you made me do
Look what you made me do
Look what you just made me do
Look what you just made me
Ooh, look what you made me do
Look what you made me do
Look what you just made me do
Look what you just made me do",Look What You Made Me Do
"Romeo, take me somewhere we can be alone
I'll be waiting, all there's left to do is run
You'll be the prince and I'll be the princess
It's a love story, baby, just say, ""Yes""

Romeo, take me somewhere we can be alone
I'll be waiting, all there's left to do is run
You'll be the prince and I'll be the princess
It's a love story, baby, just say, ""Yes""
Romeo, save me, they're trying to tell me how to feel
This love is difficult, but it's real
Don't be afraid, we'll make it out of this mess
It's a love story, baby, just say, ""Yes""

And I said, ""Romeo, save me, I've been feeling so alone
I keep waiting for you, but you never come
Is this in my head? I don't know what to think""
He knelt to the ground and pulled out a ring, and said
""Marry me, Juliet, you'll never have to be alone
I love you and that's all I really know
I talked to your dad, go pick out a white dress
It's a love story, baby, just say, 'Yes'""",Love Story (Taylor's Version)
"Can I go where you go?
Can we always be this close?
Forever and ever, ah
Take me out and take me home
You're my, my, my, my lover",Lover
"I’m so sick of running as fast as I can
Wonderin' if I'd get there quicker if I was a man
And I'm so sick of them comin' at me again
'Cause if I was a man, then I'd be the man
I'd be the man (Man)
I’d be the man (Man)",The Man
"Me-e-e, ooh-ooh-ooh-ooh
I'm the only one of me
Baby, that's the fun of me
Eeh-eeh-eeh, ooh-ooh-ooh-ooh
You're the only one of you
Baby, that's the fun of you
And I promise that nobody's gonna love you like me-e-e

Me-e-e (Yeah), ooh-ooh-ooh-ooh (And I want ya, baby)
I'm the only one of me (I'm the only one of me)
Baby, that's the fun of me (Baby, that's the fun of me)
Eeh-eeh-eeh, ooh-ooh-ooh-ooh (Oh)
You're the only one of you (Oh)
Baby, that's the fun of you
And I promise that nobody's gonna love you like me-e-e",Me!
"Someday, I'll be livin' in a big old city
And all you're ever gonna be is mean
Someday, I'll be big enough so you can't hit me
And all you're ever gonna be is mean
Why you gotta be so mean?",Mean
"Cause you could be the one that I love
I could be the one that you dream of
A message in a bottle is all I can do
Standin' here, hopin' it gets to you
You could be the one that I keep, and I
I could be the reason you can't sleep at night
A mеssage in a bottle is all I can do
Standin' herе, hopin' it gets to yo
",Message in a Bottle (Taylor's Version) (From the Vault)
"Do you remember, we were sittin' there by the water?
You put your arm around me for the first time
You made a rebel of a careless man's careful daughter
You are the best thing that's ever been mine

Do you remember, we were sittin' there by the water?
You put your arm around me for the first time
You made a rebel of a careless man's careful daughter
You are the best thing that's ever been mine
Do you remember all the city lights on the water?
You saw me start to believe for the first time
You made a rebel of a careless man's careful daughter
You are the best thing that's ever been mine

You said, ""I remember how we felt sitting by the water
And every time I look at you, it's like the first time
I fell in love with a careless man's careful daughter
She is the best thing that's ever been mine""",Mine
"Hello, Mr. ""Perfectly fine""
How's your heart after breakin' mine?
Mr. ""Always at the right place at the right time,"" baby
Hello, Mr. ""Casually cruel""
Mr. ""Everything revolves around you""
I've been Miss Misery since your goodbye
And you're Mr. ""Perfectly fine""",Mr. Perfectly Fine (Taylor's Version) (From the Vault)
"Cause baby, I could build a castle
Out of all the bricks they threw at me
And every day is like a battle
But every night with us is like a dream
Baby, we're the new romantics
Come on, come along with me
Heartbreak is the national anthem
We sing it proudly
We are too busy dancing
To get knocked off our feet
Baby, we're the new romantics
The best people in life are free",New Romantics
"She says, ""I think he did it, but I just can't prove it""
I think he did it, but I just can't prove it
I think he did it, but I just can't prove it
No, no body, no crime
But I ain't lettin' up until the day I die

I think he did it, but I just can't prove it (He did it)
I think he did it, but I just can't prove it (He did it)
I think he did it, but I just can't prove it
No, no body, no crime
But I ain't lettin' up until the day I die

They think she did it, but they just can't prove it
They think she did it, but they just can't prove it
She thinks I did it, but she just can't prove it","No Body, No Crime"
"But only the young, only the young
Only the young, only the young
Can run
Can run
So run, and run, and run

Only one thing can save us
Only the young (Only the young)
Only the young (Only the young)
Only the young (Only the young)
Only the young
Only the young (Only the young)
Only the young (Only the young)
Only the young (Only the young)
Only the young
Only the young (Only the young; Don't say you're too tired to fight)
Only the young (Only the young; It's just a matter of time)
Only the young (Only the young; Up there's the finish line)
Only the young
Can run",Only the Young
"Our song is the slamming screen door
Sneakin' out late, tapping on your window
When we're on the phone and you talk real slow
'Cause it's late and your mama don't know
Our song is the way you laugh
The first date: ""Man, I didn't kiss her, and I should have""
And when I got home, 'fore I said amen
Askin' God if he could play it again",Our Song
"So don't you worry your pretty little mind
People throw rocks at things that shine
And life makes love look hard
The stakes are high, the water's rough
But this love is ours

So don't you worry your pretty little mind
People throw rocks at things that shine
And life makes love look hard
Don't you worry your pretty little mind
People throw rocks at things that shine
But they can't take what's ours
They can't take what's ours
The stakes are high, the water's rough
But this love is ours",Ours
"Are we out of the woods yet? Are we out of the woods yet?
Are we out of the woods yet? Are we out of the woods?
Are we in the clear yet? Are we in the clear yet?
Are we in the clear yet, in the clear yet? Good
Are we out of the woods yet? Are we out of the woods yet?
Are we out of the woods yet? Are we out of the woods?
Are we in the clear yet? Are we in the clear yet?
Are we in the clear yet, in the clear yet? Good
(Are we out of the woods?)

Are we out of the woods yet? Are we out of the woods yet? (Yeah, yeah)
Are we out of the woods yet? Are we out of the woods?
Are we in the clear yet? Are we in the clear yet? (Say, are we?)
Are we in the clear yet, in the clear yet? Good
Are we out of the woods yet? Are we out of the woods yet?
Are we out of the woods yet? Are we out of the woods?
Are we in the clear yet? (Yeah) Are we in the clear yet? (Yeah)
Are we in the clear yet, in the clear yet? Good (Clear yet? Good)
Are we out of the woods yet? Are we out of the woods yet?
Are we out of the woods yet? Are we out of the woods?
Are we in the clear yet? Are we in the clear yet?
Are we in the clear yet, in the clear yet? Good (Do you remember?)
Are we out of the woods yet? Are we out of the woods yet?
Are we out of the woods yet? Are we out of the woods?
Are we in the clear yet? Are we in the clear yet?
Are we in the clear yet, in the clear yet? Good",Out of the Woods
"I hate that stupid old pickup truck you never let me drive
You're a redneck heartbreak who's really bad at lyin'
So, watch me strike a match on all my wasted time
As far as I'm concerned, you're just another picture to burn

'Cause I hate that stupid old pickup truck you never let me drive
You're a redneck heartbreak who's really bad at lyin'
So, watch me strike a match on all my wasted time
As far as I'm concerned, you're just another picture to burn

'Cause I hate that stupid old pickup truck you never let me drive
You're a redneck heartbreak who's really bad at lyin'
So, watch me strike a match on all my wasted time
In case you haven't heard
I really, really hate that stupid old pickup truck you never let me drive
You're a redneck heartbreak who's really bad at lyin'
So, watch me strike a match on all my wasted time
As far as I'm concerned, you're just another picture to burn",Picture to Burn
"Losing him was blue like I'd never known
Missing him was dark gray, all alone (Woah)
Forgetting him was like tryin' to know somebody you never met
But loving him was red (Red, red)
(Red, red)
But loving him was red (Red, red)
(Red, red)",Red (Taylor's Version)
"Are you really gonna talk about timing in times like these?
And let all your damage damage me
And carry your baggage up my street
And make me your future history, it’s time
You've come a long way, open the blinds, let me see your face
You wouldn't be the first renegade to need somebody",Renegade (feat. Taylor Swift)
"""Come on, baby, with me
We're going to fly away from here
You were my best four years""

""Come on, baby, with me
We're going to fly away from here
Out of this curtained room and this hospital gray
We'll just disappear
Come on, baby, with me
We're going to fly away from here
You were my best four years""

Come on, baby, with me
We're going to fly away from here
Come on, baby, with me
We're going to fly away from here
You were my best four years",Ronan (Taylor's Version)
"Just close your eyes
The sun is going down
You'll be alright
No one can hurt you now
Come morning light
You and I'll be safe and sound",Safe & Sound (Taylor's Version)
"Cause the players gonna play, play, play, play, play
And the haters gonna hate, hate, hate, hate, hate
Baby, I'm just gonna shake, shake, shake, shake, shake
I shake it off, I shake it off
Heartbreakers gonna break, break, break, break, break
And the fakers gonna fake, fake, fake, fake, fake
Baby, I'm just gonna shake, shake, shake, shake, shake
I shake it off, I shake it off",Shake It Off
"You should've said no, you should've gone home
You should've thought twice 'fore you let it all go
You should've known that word
'Bout what you did with her'd get back to me (Get back to me)
And I should've been there, in the back of your mind
I shouldn't be asking myself why
You shouldn't be begging for forgiveness at my feet
You should've said no
Baby, and you might still have me",Should've Said No
"Drop everything now, meet me in the pouring rain
Kiss me on the sidewalk, take away the pain
'Cause I see sparks fly whenever you smile
Get me with those green eyes, baby, as the lights go down
Give me something that'll haunt me when you're not around
'Cause I see sparks fly whenever you smile",Sparks Fly
